date,type,id,title,imdb,tmdb,fandango,scary-meter,release-year,release-day,runtime,plot,notes,poster,trailer
,Bonus,Frankenstein vs. the Mummy (2015),Frankenstein vs. the Mummy,tt3295482,319188,,?,2015,Feb 10,1h 54m,"The mummy of a cursed pharaoh and a reanimated corpse terrorize a medical university. Only an Egyptologist and a college professor, the deranged Dr. Frankenstein, may be able to stop the creatures before it's too late.",,https://image.tmdb.org/t/p/w500/bZMW2zU5JwmLAQ81hy0TolXiHBC.jpg,https://www.youtube.com/watch?v=8n8WkoBW_Ic
,Bonus,Bubba Ho-Tep (2002),Bubba Ho-Tep,tt0281686,9707,,?,2002,Oct 10,1h 54m,"When residents of their nursing home start dying of dubious causes, an aged Elvis and an African-American senior who claims to be President John F. Kennedy discover that the perpetrator is an Egyptian mummy with murderous intentions.",,https://image.tmdb.org/t/p/w500/pKQBit5ZV7GEOTiMBSYC6xBn86K.jpg,https://www.youtube.com/watch?v=pXGP07vrab8
,Bonus,Community (S3 E5),Community: Horror Fiction in Seven Spooky Steps,tt2063145,18347,,0.0,2011,Oct 27,21m,"During her pre-Halloween party, Britta gets everyone to tell a spooky story so that she can find out which member of the study group scored out as a psychopath on their psychology profiles.",Season 3 Episode 5 🏆 2024 Biggest Weener pick,https://www.themoviedb.org/t/p/w1280/3KUjDt8XY7w2Ku70UE0SECmv1zP.jpg,https://www.youtube.com/watch?v=lsPq9dBU7Gk
,Bonus,Companion (2025),Companion,tt26584495,1084199,,3.2,2025,Jan 31,1h 37m,A weekend getaway with friends at a remote cabin turns into chaos after it's revealed that one of the guests is not what they seem.,🏆 2024 Biggest Weener pick,https://image.tmdb.org/t/p/w500/oCoTgC3UyWGfyQ9thE10ulWR7bn.jpg,https://www.youtube.com/watch?v=Qr_kX0D3DNA
,Bonus,Dawn of the Dead (2004),Dawn of the Dead,tt0363547,924,,5.3,2004,Mar 19,1h 41m,"A nurse, a policeman, a young married couple, a salesman and other survivors of a worldwide plague that is producing aggressive, flesh-eating zombies, take refuge in a mega Midwestern shopping mall.",🏆 2024 Biggest Weenie pick,https://image.tmdb.org/t/p/w500/ttquyxStEEctzghtA2f4PUGprDr.jpg,https://www.youtube.com/watch?v=j69OPw9nFHw
,Bonus,Final Destination: Bloodlines (2025),Final Destination: Bloodlines,tt9619824,574475,,5.7,2025,May 16,1h 50m,"Plagued by a recurring violent nightmare, a college student returns home to find the one person who can break the cycle and save her family from the horrific fate that inevitably awaits them.",,https://image.tmdb.org/t/p/w500/6WxhEvFsauuACfv8HyoVX6mZKFj.jpg,https://www.youtube.com/watch?v=UWMzKXsY9A4
,Bonus,Lilly Lives Alone (2025),Lilly Lives Alone,tt22169494,1367763,,?,2025,Aug 22,1h 40m,"Guided by the ghost of her daughter, a guilt ridden mother plunges into madness through the course of drug fueled fever dream.",,https://image.tmdb.org/t/p/w500/w6aIZIGNlGqTvfRaRG1p2FlBXJl.jpg,https://www.youtube.com/watch?v=89i4MvTdh8c
,Bonus,The Ritual (2025),The Ritual,tt32194932,1278950,,5.0,2025,Jun 06,1h 38m,"Two priests, one in crisis with his faith and the other confronting a turbulent past, must overcome their differences to perform a risky exorcism.",,https://image.tmdb.org/t/p/w500/uubL8yvtEBjz3V7DFQHjCuSQO8w.jpg,https://www.youtube.com/watch?v=XOTGjxMb2Jo
,Bonus,The Strangers: Chapter 2 (2025),The Strangers: Chapter 2,tt28671344,1010756,https://www.fandango.com/the-strangers-chapter-2-2025-241170/movie-overview,?,2025,Sep 26,1h 36m,"On the final day of their cross country road trip, a couple's vehicle breaks down, forcing them to take refuge in a remote Airbnb. As night falls, three masked strangers terrorize them until dawn.",,https://image.tmdb.org/t/p/w500/r2E1RJf3Mz7tF4t4IyaouT1nFFq.jpg,https://www.youtube.com/watch?v=vJ4UYUUeI1c
,Bonus,The Birds (1963),The Birds,tt0056869,571,,3.7,1963,Mar 29,1h 59m,A wealthy San Francisco socialite pursues a potential boyfriend to a small Northern California town that slowly takes a turn for the bizarre when birds of all kinds suddenly begin to attack people.,🏆 2024 Biggest Weenie pick,https://image.tmdb.org/t/p/w500/eClg8QPg8mwB6INIC4pyR5pAbDr.jpg,https://www.youtube.com/watch?v=lCxR7dlavwg
,Bonus,Ghost Ship (2002),Ghost Ship,tt0288477,9645,,4.0,2002,Oct 25,1h 31m,"A salvage crew discovers a long-lost 1962 passenger ship floating lifeless in a remote region of the Bering Sea, and soon notices that its long-dead inhabitants may still be on board.",🏆 2022 Biggest Weenie pick,https://image.tmdb.org/t/p/w500/kIlzZJqV4SCGHrrjoGLBhmsO7z2.jpg,https://www.youtube.com/watch?v=_RlzNBlMQpY